{
  "$schema": "https://json-schema.org/draft/2020-12/schema",
  "$id": "https://medmentor.local/schemas/case.schema.json",
  "title": "MedMentor Case File",
  "description": "Schema for authored medical simulation case files stored under the cases directory.",
  "type": "object",
  "additionalProperties": false,
  "required": [
    "id",
    "version",
    "category",
    "title",
    "difficulty",
    "tags",
    "patientName",
    "patientAge",
    "patientSex",
    "patientBrief",
    "passport",
    "vitals",
    "openingComplaint",
    "authorNote",
    "facts",
    "diagnosisOptions",
    "correctDiagnosis"
  ],
  "properties": {
    "id": {
      "type": "string",
      "minLength": 1,
      "description": "Stable unique case identifier used by the backend and frontend."
    },
    "version": {
      "type": "integer",
      "minimum": 1,
      "description": "Positive integer revision number for the case definition."
    },
    "category": {
      "type": "string",
      "minLength": 1,
      "description": "Human-readable category label used for filtering and display."
    },
    "title": {
      "type": "string",
      "minLength": 1,
      "description": "Short author-facing case title."
    },
    "difficulty": {
      "type": "string",
      "minLength": 1,
      "description": "Simple difficulty label such as easy, medium, or hard."
    },
    "tags": {
      "type": "array",
      "description": "Short topical tags used for future filtering, search, or authoring support.",
      "minItems": 1,
      "items": {
        "type": "string",
        "minLength": 1
      }
    },
    "patientName": {
      "type": "string",
      "minLength": 1,
      "description": "Displayed patient name."
    },
    "patientAge": {
      "type": "integer",
      "minimum": 0,
      "description": "Patient age in years."
    },
    "patientSex": {
      "type": "string",
      "minLength": 1,
      "description": "Simple patient sex label used in UI and prompts."
    },
    "patientBrief": {
      "type": "string",
      "minLength": 1,
      "description": "Short frontend-safe patient summary shown on the case card."
    },
    "passport": {
      "type": "object",
      "description": "Structured patient passport revealed during a physical exam.",
      "additionalProperties": false,
      "required": [
        "heightCm",
        "weightKg",
        "allergies",
        "chronicConditions",
        "smoking"
      ],
      "properties": {
        "heightCm": {
          "type": "integer",
          "minimum": 50,
          "maximum": 250,
          "description": "Patient height in centimetres."
        },
        "weightKg": {
          "type": "number",
          "minimum": 10,
          "maximum": 300,
          "description": "Patient weight in kilograms."
        },
        "allergies": {
          "type": "string",
          "minLength": 1,
          "description": "Allergies summary text shown to the user (e.g. 'не выявлено')."
        },
        "chronicConditions": {
          "type": "string",
          "minLength": 1,
          "description": "Chronic conditions summary text (e.g. 'АГ, СД 2 типа')."
        },
        "smoking": {
          "type": "string",
          "minLength": 1,
          "description": "Smoking status summary text (e.g. '20 лет, 1 пачка/день' or 'не курит')."
        }
      }
    },
    "vitals": {
      "type": "object",
      "description": "Vital signs revealed during a physical exam. Hidden until the user requests an exam.",
      "additionalProperties": false,
      "required": [
        "heartRate",
        "bloodPressure",
        "respiratoryRate",
        "spo2",
        "temperatureC"
      ],
      "properties": {
        "heartRate": {
          "type": "integer",
          "minimum": 20,
          "maximum": 250,
          "description": "Heart rate in beats per minute."
        },
        "bloodPressure": {
          "type": "string",
          "minLength": 1,
          "description": "Blood pressure as 'systolic/diastolic' in mmHg (e.g. '158/96')."
        },
        "respiratoryRate": {
          "type": "integer",
          "minimum": 4,
          "maximum": 80,
          "description": "Respiratory rate in breaths per minute."
        },
        "spo2": {
          "type": "integer",
          "minimum": 50,
          "maximum": 100,
          "description": "Peripheral oxygen saturation in percent."
        },
        "temperatureC": {
          "type": "number",
          "minimum": 30,
          "maximum": 45,
          "description": "Body temperature in degrees Celsius."
        }
      }
    },
    "openingComplaint": {
      "type": "string",
      "minLength": 1,
      "description": "Seed complaint that guides the opening patient message."
    },
    "authorNote": {
      "type": "string",
      "minLength": 1,
      "description": "Hidden authoring guidance for the model; keep this case-specific."
    },
    "facts": {
      "type": "object",
      "description": "Structured interview facts grouped into simple buckets.",
      "additionalProperties": false,
      "required": [
        "symptoms",
        "history",
        "negatives"
      ],
      "properties": {
        "symptoms": {
          "type": "array",
          "description": "Positive symptoms the patient can reveal when questioned.",
          "items": {
            "type": "string",
            "minLength": 1
          }
        },
        "history": {
          "type": "array",
          "description": "Relevant history or context facts the patient can reveal when questioned.",
          "items": {
            "type": "string",
            "minLength": 1
          }
        },
        "negatives": {
          "type": "array",
          "description": "Explicit negative findings or absent symptoms.",
          "items": {
            "type": "string",
            "minLength": 1
          }
        }
      }
    },
    "diagnosisOptions": {
      "type": "array",
      "description": "Plausible final diagnosis choices presented to the user.",
      "minItems": 2,
      "items": {
        "type": "string",
        "minLength": 1
      }
    },
    "correctDiagnosis": {
      "type": "string",
      "minLength": 1,
      "description": "Exact correct diagnosis string. It should match one item from diagnosisOptions."
    }
  }
}
