{
  "id": "infection-cellulitis-001",
  "version": 1,
  "category": "Infections",
  "title": "Острая краснота и отёк левой голени у мужчины 41 года",
  "difficulty": "medium",
  "tags": [
    "целлюлит",
    "эритема голени",
    "лихорадка",
    "микоз стоп",
    "входные ворота инфекции"
  ],
  "patientName": "И. О.",
  "patientAge": 41,
  "patientSex": "мужской",
  "patientBrief": "Сутки назад остро появились боль, покраснение, отёк и местное повышение температуры на левой голени; общее недомогание и лихорадка.",
  "passport": {
    "heightCm": 178,
    "weightKg": 82,
    "allergies": "не выявлено",
    "chronicConditions": "не выявлено",
    "smoking": "не курит"
  },
  "vitals": {
    "heartRate": 92,
    "bloodPressure": "135/80",
    "respiratoryRate": 16,
    "spo2": 98,
    "temperatureC": 37.8
  },
  "openingComplaint": "Доктор, у меня вчера за день левая голень покраснела, припухла и стала горячей. Ходить больно, и температура поднялась. Терапевт прислал в стационар.",
  "authorNote": "41-летний мужчина-инженер, физически активный, 2–3 раза в неделю играет в любительский футбол. Чувствует себя неважно, но в сознании, говорит спокойно и обстоятельно. О предыдущем похожем эпизоде (около 3 месяцев назад, прошёл самостоятельно за несколько дней) рассказывает только при прямом вопросе о ранее перенесённых подобных эпизодах. О старом переломе наружной лодыжки слева в 19 лет — только при прямом вопросе о травмах в анамнезе или операциях. О межпальцевом грибке стоп рассказывает только при прямом вопросе об осмотре стоп, состоянии кожи между пальцами или возможных входных воротах инфекции; считает это мелочью («в команде у нас у многих такое»). О работе и любительском футболе — при прямом вопросе о профессии и образе жизни. Лабораторные и инструментальные данные пациент знает в общих чертах («сказали, что воспаление есть, тромбоза нет»); конкретные цифры и заключения УЗИ/рентгена раскрывайте только при прямом запросе врача о результатах обследований или о карте. Самостоятельно диагнозов не предлагает; слова «целлюлит», «рожа», «флегмона» не использует — описывает бытовым языком: «покраснение», «припухло», «горячая нога».",
  "facts": {
    "symptoms": [
      "острая боль в левой голени, усиливающаяся при ходьбе и пальпации",
      "разлитое покраснение кожи левой голени",
      "отёк левой голени и стопы",
      "местное повышение температуры кожи в области поражения",
      "общее недомогание, разбитость, утомляемость",
      "повышение температуры тела до 37,8 °C",
      "ощущение «как при ОРВИ»"
    ],
    "history": [
      "симптомы появились вчера и в течение суток нарастали",
      "около 3 месяцев назад был похожий эпизод покраснения и отёка той же голени, прошёл самостоятельно за 4 дня",
      "в возрасте 19 лет — перелом наружной лодыжки слева, лечился консервативно, без оперативного вмешательства",
      "работает инженером в офисе",
      "2–3 раза в неделю играет в любительский футбол с друзьями",
      "явной травмы или ушиба голени накануне не помнит",
      "при осмотре стоп — мацерация и шелушение в межпальцевых промежутках слева, длительный анамнез межпальцевого грибка стоп",
      "лекарственной аллергии не отмечал, постоянно лекарственных препаратов не принимает",
      "при осмотре: обширная зона эритемы, отёка и болезненности по передне-наружной поверхности левой голени и тыла стопы; кожа в очаге горячая; пульсация на тыльной артерии стопы и задней большеберцовой артерии сохранена; чувствительность и сила в стопе сохранены; левая голень незначительно увеличена в объёме по сравнению с правой",
      "лабораторно: ОАК и биохимия (мочевина, креатинин, АЛТ, АСТ) — без отклонений; СРБ 35 мг/л; АСЛО — не повышен",
      "рентгенография левого голеностопного сустава: визуализируется консолидированный старый перелом наружной лодыжки, признаков остеомиелита нет",
      "УЗДГ вен левой нижней конечности: данных за тромбоз глубоких вен нет",
      "посев крови (через 7 суток инкубации): роста микрофлоры не получено"
    ],
    "negatives": [
      "сахарного диабета, заболеваний периферических артерий и вен в анамнезе нет",
      "хронического лимфостаза и постоянных отёков ног ранее не было",
      "инъекционные наркотики не употребляет",
      "укусов клещей и недавних походов в лес/работы с дикими животными не было",
      "укусов и царапин от домашних или диких животных не было",
      "купания в открытых водоёмах с порезами и повреждениями кожи не было",
      "других элементов сыпи на туловище и конечностях нет",
      "очаг поражения единичный — других подобных пятен нет",
      "проведённого ранее тромбоза вен или известной тромбофилии в анамнезе нет",
      "тошноты, рвоты и головной боли нет",
      "одышки и кашля нет"
    ]
  },
  "diagnosisOptions": [
    "Бактериальный целлюлит левой голени",
    "Узловатая эритема (erythema nodosum)",
    "Мигрирующая эритема (болезнь Лайма)",
    "Тромбоз глубоких вен левой нижней конечности",
    "Травматическое повреждение мягких тканей с подкожной гематомой"
  ],
  "correctDiagnosis": "Бактериальный целлюлит левой голени"
}