{
  "id": "infection-leptospirosis-001",
  "version": 1,
  "category": "Infections",
  "title": "Лихорадка, кашель и миалгии у работника мясокомбината",
  "difficulty": "hard",
  "tags": [
    "лихорадка",
    "миалгия",
    "зоонозная инфекция",
    "контакт с животными",
    "конъюнктивальная инъекция"
  ],
  "patientName": "Андрей Васильевич Захаров",
  "patientAge": 42,
  "patientSex": "мужской",
  "patientBrief": "Около двух недель — лихорадка, кашель, выраженная ломота в теле и слабость; работает на мясокомбинате.",
  "passport": {
    "heightCm": 178,
    "weightKg": 84,
    "allergies": "не выявлено",
    "chronicConditions": "не выявлено",
    "smoking": "не курит 5 лет (прежний стаж был)"
  },
  "vitals": {
    "heartRate": 113,
    "bloodPressure": "112/70",
    "respiratoryRate": 18,
    "spo2": 96,
    "temperatureC": 38.5
  },
  "openingComplaint": "Доктор, уже недели две не могу выкарабкаться: температура то и дело за 38, ознобы, всё тело ломит, особенно ноги. Кашель сухой, голова болит. Думал, грипп, а не проходит — терапевт направил в стационар.",
  "authorNote": "42-летний мужчина, работает обвальщиком на мясокомбинате — ежедневный контакт с сырым мясом и тушами животных. Болеет около двух недель, чувствует себя плохо, но в сознании, говорит обстоятельно. О месте работы и характере деятельности (разделка мяса, частые мелкие порезы и ссадины на руках, периодическое присутствие грызунов на территории комбината) рассказывает только при прямом вопросе о профессии или о возможных профессиональных и животных контактах. О том, что миалгии особенно выражены в икроножных мышцах («ноги как избитые, до боли»), упоминает только при прямом вопросе о локализации боли в мышцах. О поездке в Испанию 6 месяцев назад — только при прямом вопросе о путешествиях. О том, что бросил курить 5 лет назад, — при прямом вопросе о вредных привычках. Лабораторные и инструментальные данные знает в общих чертах («сказали, печёночные пробы плохие, печень и селезёнка увеличены, рентген чистый»); конкретные цифры, посевы и серологию раскрывайте только при прямом запросе врача о результатах анализов или о карте. Самостоятельно диагнозов не предлагает; слова «лептоспироз», «бруцеллёз», «Q-лихорадка» не использует — описывает бытовым языком.",
  "facts": {
    "symptoms": [
      "лихорадка с ознобами около 2 недель, температура поднимается до 38,5–39 °C",
      "выраженные миалгии, особенно интенсивные в икроножных мышцах (болезненность при пальпации)",
      "сухой малопродуктивный кашель",
      "головная боль",
      "общая слабость и разбитость",
      "ощущение «как при тяжёлом гриппе» в начале заболевания",
      "субъективное покраснение глаз без выделений"
    ],
    "history": [
      "острое начало около 2 недель назад с озноба, головной боли и лихорадки",
      "после первого дня болезни взял отгул и попытался вернуться к работе",
      "через 4–5 дней самочувствие ухудшилось, обратился к участковому терапевту, направлен в стационар",
      "работает обвальщиком на мясокомбинате; в работе — постоянный контакт с сырым мясом и тушами",
      "на руках — регулярные мелкие порезы и ссадины при разделке мяса",
      "на территории мясокомбината периодически встречаются грызуны",
      "не курит 5 лет; алкоголь употребляет умеренно",
      "6 месяцев назад с семьёй отдыхал в Испании",
      "при осмотре: T 38,5 °C; ЧСС 113; АД 112/70; склеры и конъюнктивы инъецированы (покраснение глаз без желтухи и без гнойного отделяемого); сыпи на коже нет; периферические лимфоузлы не увеличены; в лёгких единичные мелкопузырчатые хрипы в нижних отделах слева; ССС — без особенностей; селезёнка пальпируется у края рёберной дуги; печень выступает на 2 см ниже рёберной дуги; пальпация икроножных мышц болезненна",
      "общий анализ крови: Hb 146 г/л, лейкоциты 9,1 × 10⁹/л (нейтрофилы 5,6, лимфоциты 2,9), тромбоциты 202 × 10⁹/л — без выраженных отклонений",
      "биохимический анализ крови: креатинин 168 мкмоль/л, мочевина 9,0 ммоль/л; общий билирубин 20 мкмоль/л; АЛТ 166 ЕД/л; ЩФ 134 ЕД/л; ГГТП 196 ЕД/л; СРБ 88 мг/л",
      "рентгенография органов грудной клетки: без патологии",
      "посев мокроты: представители обычной флоры верхних дыхательных путей, патогенов не выделено",
      "посев крови: на момент рассмотрения культивирование продолжается; срок инкубации продлён до 2 недель для возможного выделения медленнорастущих возбудителей",
      "серология крови (по согласованию с микробиологом): ИФА на лептоспиры — слабоположительная (сомнительный результат); на Q-лихорадку (Coxiella burnetii), бруцеллёз и вирусные гепатиты A/B/C — отрицательная",
      "контрольная (реконвалесцентная) серология через 3 недели: четырёхкратное и более повышение титра антител к Leptospira — с 1:40 до 1:320 (серовар L. hardjo)"
    ],
    "negatives": [
      "желтухи и видимого окрашивания склер нет",
      "сыпи на коже нет",
      "увеличения периферических лимфоузлов нет",
      "кровохарканья и значительной мокроты нет",
      "выраженной потери массы тела нет",
      "ночных потов и контакта с больными туберкулёзом не отмечает",
      "хронических заболеваний лёгких, печени и почек ранее не было",
      "тяжёлые формы алкогольной зависимости отрицает",
      "укусов клещей и пребывания в эндемичных по клещевым инфекциям районах не помнит",
      "в тропических странах за последний год не был",
      "купания в открытых пресных водоёмах в последние недели не было",
      "контакта с пациентами с подобными симптомами не отмечает",
      "инъекционных наркотиков не употребляет"
    ]
  },
  "diagnosisOptions": [
    "Лептоспироз",
    "Бруцеллёз",
    "Q-лихорадка (коксиеллёз)",
    "Внебольничная атипичная пневмония",
    "Грипп с тяжёлым течением"
  ],
  "correctDiagnosis": "Лептоспироз"
}