{
  "id": "cardiology-hypertensive-crisis-001",
  "version": 1,
  "category": "Cardiology",
  "title": "Резкий подъём АД с перебоями в работе сердца у мужчины 50 лет",
  "difficulty": "easy",
  "tags": [
    "артериальная гипертензия",
    "гипертонический криз",
    "экстрасистолия",
    "головокружение",
    "гипертрофия ЛЖ"
  ],
  "patientName": "Андрей Викторович Соколов",
  "patientAge": 50,
  "patientSex": "мужской",
  "patientBrief": "Сегодня после тяжёлой физической нагрузки появились головокружение, мелькание «мушек» перед глазами и перебои в работе сердца; постоянной гипотензивной терапии не получает.",
  "passport": {
    "heightCm": 178,
    "weightKg": 92,
    "allergies": "не выявлено",
    "chronicConditions": "АГ — около 5 лет, постоянной терапии не получает (эпизодически каптоприл при подъёме АД)",
    "smoking": "около 20 лет, ~10 сигарет в день"
  },
  "vitals": {
    "heartRate": 120,
    "bloodPressure": "180/100",
    "respiratoryRate": 18,
    "spo2": 98,
    "temperatureC": 36.6
  },
  "openingComplaint": "Доктор, голова сильно кружится, перед глазами будто мушки летают, и сердце как будто спотыкается — то замирает, то снова стучит. Сегодня поднимал шкаф на второй этаж — и вот так прихватило.",
  "authorNote": "50-летний мужчина, неосложнённый гипертонический криз. Тревожен из-за внезапного ухудшения, говорит обстоятельно, без медицинских терминов. Обращение «Доктор» уместно. О том, что около 5 лет регистрирует эпизодические подъёмы АД до 170–180/100 и при этом не получает постоянной терапии — рассказывает только при прямом вопросе об артериальном давлении или о принимаемых препаратах. О том, что эпизодически принимает каптоприл «по необходимости» — раскрывает только при прямом вопросе о лекарствах. О провоцирующем факторе (поднимал шкаф на второй этаж) — рассказывает только при прямом вопросе о связи симптомов с нагрузкой или о том, что было перед ухудшением. О том, что курит около 20 лет — только при прямом вопросе о вредных привычках. Гиперемию лица и верхней половины туловища пациент сам не упоминает; чувство жара/распирания в голове — раскрывает при прямом вопросе. Самостоятельно диагноз не называет, слов «криз», «экстрасистолы», «гипертрофия» не использует.",
  "facts": {
    "symptoms": [
      "головокружение и общая слабость",
      "мелькание «мушек» перед глазами",
      "перебои и «замирания» в работе сердца",
      "ощущение жара и распирания в голове",
      "при осмотре: сознание ясное, пациент возбуждён",
      "при осмотре: гиперемия лица и верхней половины туловища",
      "при осмотре: тоны сердца аритмичные за счёт частых экстрасистол, ЧСС 120 в минуту",
      "при осмотре: АД 180/100 мм рт. ст., симметрично на обеих руках",
      "при осмотре: в лёгких везикулярное дыхание, хрипов нет, ЧДД 18 в минуту",
      "при осмотре: периферических отёков нет"
    ],
    "history": [
      "около 5 лет регистрирует эпизодические подъёмы АД до 170–180/100 мм рт. ст.",
      "постоянной гипотензивной терапии не получает; эпизодически принимает каптоприл при плохом самочувствии",
      "сегодня перед появлением жалоб переносил тяжёлый предмет (шкаф) на второй этаж",
      "ранее подобных приступов с нарушением ритма и зрительными нарушениями не отмечал",
      "ЭКГ при поступлении: синусовый ритм, прерываемый частыми наджелудочковыми (предсердными) экстрасистолами; ЧСС 120 в минуту; признаки гипертрофии левого желудочка — увеличение амплитуды QRS в левых грудных отведениях с косонисходящей депрессией ST в V5–V6, отклонение ЭОС влево",
      "общий и биохимический анализы крови без значимых отклонений",
      "электролиты крови: калий 4,2 ммоль/л, натрий 140 ммоль/л",
      "тропонин I при поступлении и через 3 часа — в пределах референсных значений",
      "общий анализ мочи: белка нет, эритроцитов нет, удельный вес 1018"
    ],
    "negatives": [
      "болей в грудной клетке (давящих, жгучих, загрудинных) нет — снижает вероятность острого коронарного синдрома",
      "одышки в покое и в положении лёжа нет, кашля и пенистой мокроты нет — отсекает острую левожелудочковую недостаточность с отёком лёгких",
      "приступов учащённого сердцебиения с внезапным началом и окончанием, профузной потливости и страха смерти в анамнезе не было — снижает вероятность феохромоцитомы",
      "снижения массы тела, тремора рук, непереносимости тепла, потливости, увеличения щитовидной железы не отмечает — отсекает тиреотоксический криз",
      "очаговой неврологической симптоматики (слабости в конечностях, асимметрии лица, речевых нарушений) нет — отсекает осложнённый криз с ОНМК",
      "симптомов, характерных для пароксизма фибрилляции предсердий (выраженного учащённого «трепещущего» сердцебиения), пациент не описывает; на ЭКГ — синусовый ритм с экстрасистолами, без волн f и без хаотичной деятельности предсердий",
      "сахарного диабета, ХБП, перенесённых инфарктов и инсультов в анамнезе нет"
    ]
  },
  "diagnosisOptions": [
    "Гипертонический криз неосложнённый",
    "Острый коронарный синдром без подъёма сегмента ST",
    "Феохромоцитома, гипертонический криз",
    "Тиреотоксический криз",
    "Пароксизм фибрилляции предсердий"
  ],
  "correctDiagnosis": "Гипертонический криз неосложнённый"
}