{
  "id": "cardiology-pulmonary-embolism-001",
  "version": 1,
  "category": "Cardiology",
  "title": "Внезапная одышка и боль в грудной клетке у пожилой женщины после COVID-19",
  "difficulty": "medium",
  "tags": [
    "одышка",
    "боль в груди",
    "тромбоэмболия лёгочной артерии",
    "постковидный синдром",
    "варикозная болезнь"
  ],
  "patientName": "Т. И.",
  "patientAge": 71,
  "patientSex": "женский",
  "patientBrief": "Утром в день поступления внезапно появилась нехватка воздуха и дискомфорт за грудиной; около 3 недель назад перенесла COVID-19 на дому без антикоагулянтной терапии.",
  "passport": {
    "heightCm": 165,
    "weightKg": 75,
    "allergies": "не выявлено",
    "chronicConditions": "Гипертоническая болезнь II ст., АГ 1 ст., риск ССО 3; варикозная болезнь нижних конечностей",
    "smoking": "не курит"
  },
  "vitals": {
    "heartRate": 90,
    "bloodPressure": "110/70",
    "respiratoryRate": 22,
    "spo2": 82,
    "temperatureC": 36.4
  },
  "openingComplaint": "Доктор, утром встала — стало вдруг тяжело дышать, и в груди как будто сжимает, давит. Раньше такого никогда не было.",
  "authorNote": "71-летняя женщина, тромбоэмболия лёгочной артерии промежуточно-высокого риска, развившаяся после перенесённого 3 недели назад COVID-19. Контактна, говорит обстоятельно, обращение «Доктор» уместно. Жалобы на нехватку воздуха и дискомфорт за грудиной появились сегодня утром остро, до этого подобного никогда не было. О перенесённой 3 недели назад коронавирусной инфекции (лечилась дома симптоматически, антикоагулянтную терапию не получала) — рассказывает только при прямом вопросе о недавно перенесённых заболеваниях, лихорадке за последние месяцы или о ковиде. О том, что во время болезни и после неё около 2 недель преимущественно лежала и мало двигалась — раскрывает только при прямом вопросе о двигательном режиме / постельном режиме. О давней варикозной болезни вен нижних конечностей — раскрывает при прямом вопросе об осмотре ног, тяжести в ногах или венах. Самостоятельно об отёках и боли в ногах не упоминает — отёков сейчас нет; периодически отмечает чувство тяжести в икрах, что может раскрыть при прямом вопросе. Лабораторные и инструментальные данные знает в общих чертах («сказали, давление в лёгочной артерии повышенное, в лёгких — тромбы»); конкретные цифры и результаты КТ-ангиографии раскрывайте только при прямом запросе врача о результатах анализов или о карте. Самостоятельно слов «ТЭЛА», «тромбоэмболия», «правый желудочек» не использует.",
  "facts": {
    "symptoms": [
      "внезапно возникшие утром в день поступления ощущение нехватки воздуха и дискомфорт в грудной клетке (давящий, без чёткой связи с дыханием)",
      "при осмотре: сознание ясное, кожные покровы обычного цвета, тёплые, нормальной влажности",
      "при осмотре: ЧДД 22 в минуту, при аускультации в лёгких везикулярное дыхание, хрипов нет",
      "при осмотре: SpO₂ 82% на атмосферном воздухе; при инсуффляции кислорода 9 л/мин — SpO₂ повышается до 96%",
      "при осмотре: ритм сердца правильный, ЧСС 90 в минуту, АД 110/70 мм рт. ст., тоны сердца приглушены",
      "при осмотре: варикозное расширение вен нижних конечностей; периферических отёков нет; температура тела 36,4 °C"
    ],
    "history": [
      "около 3 недель назад перенесла коронавирусную инфекцию (COVID-19), лечилась амбулаторно симптоматически; антикоагулянтная терапия не назначалась и не проводилась",
      "во время и около 2 недель после ковида преимущественно соблюдала постельный режим, мало двигалась",
      "много лет страдает варикозной болезнью вен нижних конечностей; ранее эпизоды тромбофлебита и ТГВ отрицает",
      "длительно — гипертоническая болезнь II стадии, АГ 1 степени, риск ССО 3",
      "ЭКГ при поступлении: синусовый ритм, ЭОС отклонена вправо, признаки острой перегрузки правых отделов сердца — глубокий зубец Q и отрицательный T в III отведении, неполная блокада правой ножки пучка Гиса",
      "лабораторные данные: антитела к SARS-CoV-2 IgM 9,61 (полож.) и IgG 333,05 (полож.), ПЦР-мазок на SARS-CoV-2 отрицательный (постковидный профиль)",
      "ОАК: лейкоциты 9,7 × 10⁹/л, лимфоциты 0,9 × 10⁹/л; СРБ 19,82 мг/л; ЛДГ 464,4 ЕД/л; ферритин 520 мкг/л; фибриноген 5,47 г/л",
      "Д-димер резко повышен — 8875 нг/мл",
      "NT-proBNP 5255 нг/л; тропонин I 130 нг/л (положительный, выше верхней границы референсного интервала)",
      "МСКТ-ангиография лёгочных артерий: в просвете правой и левой главных лёгочных артерий — протяжённый линейный дефект контрастирования по типу тромба-наездника (перекрытие просвета справа ~43%, слева ~30%); распространение на долевые и сегментарные ветви с частичным сохранением сегментарного кровотока; небольшое количество жидкости в плевральных полостях",
      "ЭхоКГ: ФВ ЛЖ по Симпсону 57%; дилатация и гипокинез свободной стенки правого желудочка при сохранной сократимости верхушки; D-образная форма ЛЖ (перегрузка правых отделов); СДЛА 48 мм рт. ст.; расширение коронарного синуса",
      "УЗДГ вен нижних конечностей: окклюзионный тромбоз поверхностных бедренных, подколенных, задних большеберцовых, суральных и малоберцовых вен с обеих сторон с признаками флотации верхушек тромбов в просвете поверхностных бедренных вен"
    ],
    "negatives": [
      "лихорадки, потрясающих ознобов, продуктивного кашля с мокротой нет — снижает вероятность внебольничной пневмонии",
      "типичной для ОКС интенсивной длительной (>20 мин) загрудинной боли с иррадиацией в челюсть/левую руку, не купирующейся нитроглицерином, нет; характер дискомфорта в груди ближе к чувству сжатия и нехватки воздуха — снижает вероятность ОКС как ведущего диагноза",
      "ортопноэ, пароксизмов ночной одышки, периферических отёков, ранее установленной хронической сердечной недостаточности нет — отсекает декомпенсацию ХСН как ведущий диагноз",
      "стойкого болевого синдрома и шумов перикардита, изменений ST по типу диффузной элевации не отмечается — снижает вероятность постковидного миоперикардита как ведущего диагноза",
      "симптомов хронического заболевания лёгких (кашель, одышка с нагрузкой за многие месяцы, длительный анамнез курения) нет",
      "очаговой неврологической симптоматики и признаков ОНМК нет",
      "приём гормональных препаратов и онкологический анамнез отрицает"
    ]
  },
  "diagnosisOptions": [
    "Тромбоэмболия лёгочной артерии, промежуточно-высокий риск",
    "Острый коронарный синдром без подъёма сегмента ST",
    "Декомпенсация хронической сердечной недостаточности",
    "Внебольничная пневмония",
    "Постковидный миоперикардит"
  ],
  "correctDiagnosis": "Тромбоэмболия лёгочной артерии, промежуточно-высокий риск"
}