{
  "id": "gastroenterology-opisthorchiasis-001",
  "version": 1,
  "category": "Gastroenterology",
  "title": "Желтуха, эозинофилия и боль в правом подреберье у студента 21 года после поездки по Оби",
  "difficulty": "hard",
  "tags": [
    "описторхоз",
    "острая фаза описторхоза",
    "холангиогепатит",
    "эозинофилия",
    "желтуха",
    "эпидемиологический анамнез"
  ],
  "patientName": "Д. А.",
  "patientAge": 21,
  "patientSex": "мужской",
  "patientBrief": "Около двух недель — субфебрилитет, боль в правом подреберье и эпигастрии, потемнение мочи и желтушность склер. Незадолго до начала болезни — путешествие по Оби с дегустацией рыбы.",
  "passport": {
    "heightCm": 180,
    "weightKg": 75,
    "allergies": "не выявлено",
    "chronicConditions": "не выявлено",
    "smoking": "не курит"
  },
  "vitals": {
    "heartRate": 88,
    "bloodPressure": "120/75",
    "respiratoryRate": 16,
    "spo2": 98,
    "temperatureC": 37.4
  },
  "openingComplaint": "Доктор, болит справа под рёбрами и в верху живота, аппетита нет, подташнивает. Моча потемнела, жена заметила, что белки глаз пожелтели. И температура держится небольшая, но всё время.",
  "authorNote": "21-летний мужчина, студент технического вуза, в Сибири был впервые. Болеет около двух недель, в сознании, говорит подробно, к ситуации относится с тревогой («думал, отравился рыбой, а уже жёлтым стал»). О летней поездке по реке Оби рассказывает только при прямом вопросе о путешествиях, поездках, отдыхе за пределами обычного места жительства за последние 1–3 месяца. О том, что в программу путешествия входили рыбалка, грибная охота и **знакомство с бытом коренных народов Севера, в том числе дегустация рыбы разного приготовления — слабосолёной, вяленой и строганины (тонко нарезанная замороженная сырая рыба)** — рассказывает только при прямом вопросе о характере питания во время поездки, о сырой/малосольной/вяленой рыбе, о национальных блюдах. О мелкой петехиальной сыпи на коже (без выраженного зуда и без расчёсов) — только при прямом вопросе о высыпаниях или изменениях кожи. О том, что симптомы развились примерно через 2 недели после возвращения из поездки и постепенно нарастали — при прямом вопросе о хронологии. Хронических заболеваний, операций, гемотрансфузий нет; гепатотоксичных препаратов не принимал, алкоголь употребляет умеренно (раскрывает на прямой вопрос). Лабораторные и инструментальные данные знает в общих чертах («сказали, эозинофилы сильно повышены, печёночные пробы плохие, билирубин высокий, печень увеличена, гепатиты А, В и Е не подтвердились»); конкретные цифры, протокол УЗИ и серологию раскрывайте только при прямом запросе врача о результатах обследований или о карте. Самостоятельно диагноз не предлагает; слов «описторхоз», «паразит», «трематода», «эозинофилия», «холангит» не использует — описывает бытовым языком («рыбу ел сырую», «глаза пожелтели», «температура небольшая всё время»).",
  "facts": {
    "symptoms": [
      "боль в правом подреберье и собственно эпигастрии — тупая, постоянная, усиливающаяся после еды",
      "снижение аппетита",
      "лёгкое подташнивание",
      "субфебрильная лихорадка с небольшим суточным размахом (37,1–37,8 °С) в течение примерно двух недель",
      "желтушность кожи и склер",
      "потемнение мочи (цвета крепкого чая)",
      "немногочисленные мелкие петехиальные высыпания на коже без зуда и расчёсов",
      "общая слабость, утомляемость"
    ],
    "history": [
      "в летние каникулы около 4–5 недель назад путешествовал по реке Оби (Западная Сибирь); в Сибири находился впервые",
      "в программу путешествия входили рыбалка, сбор грибов и знакомство с бытом коренных народов Севера",
      "**во время поездки многократно ел рыбу разного приготовления, в том числе слабосолёную, вяленую и строганину (тонко нарезанная замороженная сырая рыба) — традиционные блюда народов Севера**",
      "примерно через 2 недели после возвращения из путешествия появился дискомфорт в правом подреберье, температура повысилась до 37,1 °С",
      "в последующие дни — нарастание болей в правом подреберье и эпигастрии, снижение аппетита, лёгкое подташнивание",
      "примерно за неделю до обращения родственники заметили желтушность склер, моча стала тёмной",
      "хронических заболеваний и операций нет, гемотрансфузий не было",
      "длительного приёма НПВС, парацетамола, фитопрепаратов и БАДов не было",
      "алкоголь употребляет редко, в небольших количествах; наркотики, татуировки, пирсинг — отрицает",
      "при осмотре: состояние средней степени тяжести; температура 37,4 °С; ЧСС 88, АД 120/75, ЧД 16, SpO₂ 98%; кожа и склеры жёлтые; на коже немногочисленные участки мелкой петехиальной сыпи, расчёсов нет; в лёгких и сердце без особенностей; живот мягкий, болезненный в правом подреберье за счёт увеличенной печени — правая доля выступает из-под рёберной дуги на 4 см, левая занимает собственно эпигастрий; край печени закруглён, поверхность гладкая, плотноэластической консистенции, болезненный при пальпации; положительные пузырные симптомы Кера, Мерфи и френикус-симптом; селезёнка не пальпируется; стул оформленный; моча тёмная",
      "общий анализ крови: гемоглобин 120 г/л, эритроциты 4,2 × 10¹²/л; лейкоциты 11,9 × 10⁹/л; **эозинофилы 22% (резко выраженная эозинофилия)**, палочкоядерные 6%, сегментоядерные 60%, лимфоциты 10%, моноциты 2%; СОЭ 15 мм/ч",
      "биохимия крови: общий белок 65 г/л; альбумины 55%; γ-глобулины 23,5% (диспротеинемия с повышением γ-фракции); глюкоза 5,0 ммоль/л; общий билирубин 68 мкмоль/л — прямой 50, непрямой 18 (преобладает прямая фракция — холестатический паттерн); АЛТ 50 Ед/л, АСТ 42 Ед/л (умеренное повышение трансаминаз); ЩФ 392 Ед/л (значительно повышена; норма до 306); ГГТП 170 Ед/л (резко повышена; норма до 64); холестерин 6,6 ммоль/л; амилаза 28 ед/л — без отклонений",
      "копрограмма: нейтральный жир +, мышечные волокна непереваренные единичные, жирные кислоты и мыла +; большое количество бактерий; **яиц гельминтов и простейших не выявлено** (в острой фазе яйца Opisthorchis felineus в кале ещё могут отсутствовать — выделение начинается через 4–6 недель после инвазии)",
      "иммуноферментный анализ (ИФА): антитела к вирусам гепатитов A, B, E — отрицательны; HBsAg, анти-HCV — отрицательны; ВИЧ — отрицательный",
      "УЗИ органов брюшной полости: печень увеличена (правая доля 169 мм, норма до 150; левая 85 мм, норма до 70), структура однородная, эхогенность снижена; **расширение крупных внутрипечёночных жёлчных протоков** без признаков обструкции на уровне холедоха",
      "рентгенография органов грудной клетки: очаговых и инфильтративных изменений не выявлено",
      "ФЭГДС: в желудке и двенадцатиперстной кишке — участки гиперемии слизистой в виде полос; язвенных и эрозивных дефектов нет"
    ],
    "negatives": [
      "за рубежом за последний год не был — отсекает завозные тропические инфекции и эпидемический гепатит E из эндемичных регионов",
      "контакта с больными вирусными гепатитами, желтухой, инфекционными больными не помнит",
      "гемотрансфузий, оперативных вмешательств, татуировок, пирсинга и инъекций вне медицинских учреждений не было — снижает вероятность парентерального заражения HBV/HCV",
      "ИФА на вирусные гепатиты A, B, E и анти-HCV — отрицательны (отсекает острые вирусные гепатиты A, B, E и хронический гепатит C)",
      "длительного приёма НПВС, парацетамола в больших дозах, фитопрепаратов и БАДов не было — отсекает лекарственное поражение печени",
      "регулярного употребления алкоголя в значимых количествах не отмечает — отсекает алкогольный гепатит",
      "хронических заболеваний печени, аутоиммунных заболеваний, в семье — заболеваний печени не отмечает (снижает вероятность аутоиммунного гепатита и наследственных болезней)",
      "контакта с грызунами, купания в открытых пресных водоёмах перед началом болезни не отмечает; работа на сельскохозяйственных предприятиях и контакты с продуктивными животными — отрицает (снижает вероятность лептоспироза)",
      "укусов клещей и пребывания в эндемичных по клещевым инфекциям районах не помнит",
      "выраженного кожного зуда, расчёсов, ксантом нет",
      "лимфоаденопатии нет",
      "болей и припухания крупных суставов, кожной сыпи по типу «бабочки», сухости глаз и полости рта нет"
    ]
  },
  "diagnosisOptions": [
    "Описторхоз, острая фаза, с явлениями холангиогепатита и реактивной эозинофилией",
    "Острый вирусный гепатит A",
    "Острый вирусный гепатит E",
    "Лекарственное поражение печени",
    "Лептоспироз с поражением печени"
  ],
  "correctDiagnosis": "Описторхоз, острая фаза, с явлениями холангиогепатита и реактивной эозинофилией"
}