{
  "id": "gastroenterology-celiac-001",
  "version": 1,
  "category": "Gastroenterology",
  "title": "Хроническая диарея",
  "difficulty": "hard",
  "tags": [
    "целиакия",
    "герпетиформный дерматит Дюринга",
    "железодефицитная анемия",
    "сахарный диабет 1 типа",
    "хроническая диарея",
    "синдром мальабсорбции"
  ],
  "patientName": "М. С.",
  "patientAge": 21,
  "patientSex": "female",
  "patientBrief": "Около полугода — периодическая диарея, вздутие живота, заметная потеря веса и нарастающая слабость.",
  "passport": {
    "heightCm": 165,
    "weightKg": 47,
    "allergies": "не выявлено",
    "chronicConditions": "СД 1 типа (на базис-болюсной инсулинотерапии)",
    "smoking": "не курит"
  },
  "vitals": {
    "heartRate": 80,
    "bloodPressure": "115/75",
    "respiratoryRate": 16,
    "spo2": 99,
    "temperatureC": 36.8
  },
  "openingComplaint": "Доктор, уже полгода живот меня мучает — то понос, то вздутие, режет внутри. Сильно похудела, и сил совсем не стало.",
  "authorNote": "21-летняя девушка, студентка. Болеет около 6 месяцев. Тревожна, говорит достаточно подробно, без медицинских терминов; беспокоится из-за похудания и того, что «организм будто разваливается». О сахарном диабете 1 типа, который у неё с 14 лет (постоянная инсулинотерапия), рассказывает только при прямом вопросе о хронических заболеваниях, постоянных лекарствах или о визитах к эндокринологу. О том, что **диарея и вздутие заметно уменьшаются, если несколько дней не есть хлеб, макароны и каши**, — рассказывает только при прямом вопросе о связи симптомов с пищей, об облегчающих факторах или о том, замечала ли она зависимость от диеты; самостоятельно эту тему не поднимает. О зудящей сыпи на разгибательных поверхностях обоих локтей (мелкие группирующиеся пузырьки и пятна с расчёсами) — только при прямом вопросе об изменениях кожи или о высыпаниях. О спонтанных мелких кровоизлияниях («синячках») на руках и ногах — при прямом вопросе о синяках и кровоточивости. О потере массы тела (около 5 кг за 6 месяцев) — при прямом вопросе о весе или общем самочувствии. О том, что несколько раз в течение полугода были «лёгкие гипогликемии» (предполагает, что доза инсулина «стала большой»), — при прямом вопросе об уровне глюкозы и контроле сахара. Лабораторные данные знает в общих чертах («сказали, гемоглобин и железо низкие, ферритин низкий — анемия из-за нехватки железа»); конкретные цифры раскрывайте только при прямом запросе врача о результатах анализов или о карте. Самостоятельно диагноз не предлагает; слов «целиакия», «глютен», «герпетиформный дерматит», «мальабсорбция», «атрофия ворсинок» не использует.",
  "facts": {
    "symptoms": [
      "периодическая диарея в течение 6 месяцев — стул кашицеобразный, иногда обильный, плохо смывающийся",
      "вздутие и периодически возникающие боли в животе",
      "потеря массы тела около 5 кг за 6 месяцев",
      "общая слабость и недомогание, особенно усилившиеся в последний месяц",
      "зудящая сыпь на разгибательных поверхностях обоих локтей (мелкие группирующиеся пузырьки/папулы со следами расчёсов)",
      "спонтанные мелкие кровоизлияния («синячки») на коже рук и ног",
      "снижение работоспособности, утомляемость при обычной учебной нагрузке",
      "субъективно — потребовалось снизить дозу базального инсулина из-за частых лёгких гипогликемий"
    ],
    "history": [
      "болеет с 14 лет сахарным диабетом 1 типа, получает базис-болюсную инсулинотерапию",
      "диарея и вздутие живота беспокоят около 6 месяцев",
      "сама заметила, что **симптомы со стороны кишечника заметно уменьшаются при отказе от хлеба, макарон, каш и других мучных изделий**",
      "потеря массы тела примерно 5 кг за 6 месяцев",
      "в последний месяц появились общая слабость, недомогание",
      "за последние месяцы появились зудящая сыпь на разгибательных поверхностях локтей и спонтанные мелкие синяки на коже",
      "в семье — у матери аутоиммунный тиреоидит; иных аутоиммунных или гастроэнтерологических заболеваний в семье не отмечает",
      "за пределы региона за последние 12 месяцев не выезжала; контактов с инфекционными больными не помнит",
      "приём антибиотиков, НПВС, гормональных препаратов в последние месяцы отрицает",
      "при осмотре: температура 36,8 °С; ЧСС 80, АД 115/75, ЧД 16, SpO₂ 99%; рост 165 см, вес 47 кг (ИМТ 17,3 — дефицит массы тела); кожный покров и видимые слизистые бледные, чистые; на разгибательных поверхностях обоих локтей — группирующиеся мелкие папуло-везикулёзные элементы со следами расчёсов; единичные мелкие петехии и кровоподтёки на предплечьях и голенях; язык влажный, без налёта; в лёгких везикулярное дыхание; тоны сердца ритмичные, шумов нет; живот мягкий, при пальпации слегка болезненный в околопупочной области, без признаков раздражения брюшины; печень и селезёнка не увеличены; стул со слов пациентки до 3–4 раз в сутки, кашицеобразный, без видимой крови",
      "общий анализ крови: гемоглобин 92 г/л, эритроциты 3,8 × 10¹²/л, MCV 72 фл (микроцитоз), MCH 22 пг (гипохромия); тромбоциты 290 × 10⁹/л; лейкоциты 5,4 × 10⁹/л; СОЭ 16 мм/ч",
      "обмен железа: сывороточное железо 4,2 мкмоль/л (снижено), ферритин 6 мкг/л (резко снижен), общая железосвязывающая способность повышена, насыщение трансферрина железом снижено — подтверждает железодефицитный характер анемии",
      "биохимия крови: общий белок 58 г/л (нижняя граница), альбумин 32 г/л (умеренная гипоальбуминемия), АЛТ 22 Ед/л, АСТ 19 Ед/л, ЩФ 78 Ед/л, общий билирубин 12 мкмоль/л, общий кальций 2,05 ммоль/л (на нижней границе)",
      "контроль гликемии: HbA1c 7,2%; в последние 2–3 месяца — учащение лёгких гипогликемий, потребовавшее снижения дозы базального инсулина",
      "анализ кала на скрытую кровь — отрицательный; копрограмма: стеаторея (нейтральный жир ++), слизь и эритроциты не выявлены, патогенной флоры и простейших не обнаружено",
      "анализ кала на токсины Clostridioides difficile (A/B) — отрицательный",
      "приёма лактулозы и осмотических слабительных в анамнезе нет"
    ],
    "negatives": [
      "лихорадки и ознобов нет (отсекает острые инфекционные энтероколиты)",
      "крови и слизи в стуле визуально нет, тенезмов и ложных позывов на дефекацию не отмечает (отсекает язвенный колит)",
      "ночной диареи и выраженных болей в правой подвздошной области нет (снижает вероятность болезни Крона тонкой кишки)",
      "за пределы региона за последние 12 месяцев не выезжала, поездок в эндемичные по паразитозам регионы не было (снижает вероятность хронического лямблиоза/иных паразитозов)",
      "регулярного приёма антибиотиков и НПВС в последние месяцы не было",
      "симптомы появляются не сразу после употребления молока и не зависят строго от молочных продуктов — отсекает изолированную лактазную недостаточность как ведущий диагноз",
      "выраженных вегетативных проявлений (ортостатической гипотензии, гастропареза с упорной рвотой, недержания кала) нет — снижает вероятность диабетической автономной энтеропатии как основного механизма диареи",
      "контакта с больными туберкулёзом, ночных потов, кашля, кровохарканья нет",
      "выраженной отёчности нижних конечностей и асцита нет",
      "болей в крупных суставах, увеита, узловатой эритемы нет",
      "у близких родственников онкологических заболеваний ЖКТ не отмечает"
    ]
  },
  "diagnosisOptions": [
    "Целиакия (типичная форма) с герпетиформным дерматитом Дюринга и железодефицитной анемией",
    "Болезнь Крона с поражением тонкой кишки",
    "Лактазная недостаточность",
    "Диабетическая автономная энтеропатия",
    "Хронический лямблиоз"
  ],
  "correctDiagnosis": "Целиакия (типичная форма) с герпетиформным дерматитом Дюринга и железодефицитной анемией"
}
