{
  "id": "cardiology-renovascular-hypertension-001",
  "version": 1,
  "category": "Cardiology",
  "title": "Стойко высокое давление",
  "difficulty": "medium",
  "tags": [
    "артериальная гипертензия",
    "молодой возраст",
    "резистентная гипертензия",
    "ретинопатия",
    "вторичная гипертензия"
  ],
  "patientName": "А. Д.",
  "patientAge": 33,
  "patientSex": "female",
  "patientBrief": "Упорные головные боли и ухудшение зрения на фоне высокого давления, которое плохо снижается лекарствами.",
  "passport": {
    "heightCm": 168,
    "weightKg": 52,
    "allergies": "не выявлено",
    "chronicConditions": "АГ — около 13 лет (с 20-летнего возраста)",
    "smoking": "не курит"
  },
  "vitals": {
    "heartRate": 72,
    "bloodPressure": "210/130",
    "respiratoryRate": 16,
    "spo2": 98,
    "temperatureC": 36.6
  },
  "openingComplaint": "Доктор, голова болит почти каждый день, сил совсем нет, и в последнее время стала хуже видеть. Пью три таблетки от давления, а оно всё равно не уходит.",
  "authorNote": "33-летняя женщина с длительно существующей резистентной артериальной гипертензией. Тревожна, говорит обстоятельно. О том, что повышенное АД до 150/90 впервые случайно выявили в 20 лет (на медосмотре), что чувствовала себя хорошо и к врачам не обращалась, эпизодически принимала анаприлин — рассказывает только при прямом вопросе о начале заболевания. Об ухудшении в последние 2 года (АД 190–230/120–140), о подобранной тройной терапии (каптоприл 37,5 мг/сут, атенолол 50 мг/сут, арифон 2,5 мг/сут) с недостаточным эффектом (АД на терапии 160–170/110) — раскрывает при прямом вопросе о принимаемых препаратах и контроле давления. О снижении остроты зрения, утомляемости, периодических головных болях — упоминает в opening, детали (постепенное ухудшение, без эпизодов мерцания/диплопии) — при прямом вопросе. Сама о шуме в животе не знает — это находка врача при аускультации. Беременностей не было; гормональные контрацептивы не принимает (раскрывает при прямом вопросе о репродуктивном анамнезе). Самостоятельно слов «реноваскулярная», «фибромускулярная дисплазия», «стеноз», «вторичная гипертензия» не использует.",
  "facts": {
    "symptoms": [
      "ежедневные периодические головные боли преимущественно в затылочной и теменной областях",
      "повышенная утомляемость, снижение работоспособности в течение последних 2 лет",
      "постепенное снижение остроты зрения за последние месяцы",
      "при осмотре: астеническое телосложение, пониженного питания (ИМТ ~18,4 кг/м²)",
      "при осмотре: ЧСС 72 в минуту, АД 210/130 мм рт. ст. (симметрично на правой и левой руках)",
      "при осмотре: тоны сердца ритмичные, акцент II тона над аортой; в лёгких везикулярное дыхание, хрипов нет",
      "при осмотре: при аускультации живота в мезогастральной области (слева от пупка) выслушивается систоло-диастолический сосудистый шум",
      "при осмотре: пульсация на бедренных артериях сохранена, симметрична; периферических отёков нет"
    ],
    "history": [
      "впервые повышение АД до 150/90 мм рт. ст. случайно выявлено в 20-летнем возрасте при медосмотре",
      "до 31 года считала себя здоровой, к врачам не обращалась, эпизодически принимала анаприлин при плохом самочувствии",
      "ухудшение самочувствия около 2 лет: повышенная утомляемость, снижение работоспособности, головные боли, снижение остроты зрения",
      "при контроле АД в последние 2 года стойко регистрируются цифры 190–230/120–140 мм рт. ст.",
      "получает комбинированную гипотензивную терапию: каптоприл 37,5 мг/сут, атенолол 50 мг/сут, индапамид (арифон) 2,5 мг/сут — на фоне терапии АД снижается лишь до 160–170/110 мм рт. ст. (недостаточный эффект)",
      "общий анализ мочи: удельный вес 1022, белок 0,15 г/л, лейкоциты 2–3 в поле зрения, эритроциты 0–1 в поле зрения, цилиндров нет",
      "биохимический анализ крови: креатинин, калий, натрий — в пределах референсных значений; глюкоза в норме; липидный спектр без значимых отклонений",
      "офтальмологическое исследование (глазное дно): гипертоническая нейроангиоретинопатия с отёком дисков зрительных нервов",
      "экскреторная урография: левая почка уменьшена в размерах; отмечается задержка контрастирования чашечно-лоханочной системы и замедление выведения контрастного вещества слева",
      "ЭКГ: синусовый ритм, признаки гипертрофии левого желудочка",
      "беременностей не было, гормональных контрацептивов не принимает",
      "семейный анамнез по тяжёлой АГ и ранним сердечно-сосудистым событиям не отягощён"
    ],
    "negatives": [
      "приступов внезапного учащённого сердцебиения с профузной потливостью, бледностью, тревогой и резкими подъёмами АД, спонтанно купирующимися в течение минут, не отмечает; уровни метанефринов и норметанефринов в моче — в пределах референсных значений — отсекает феохромоцитому",
      "мышечной слабости, парестезий, эпизодов внезапного тяжёлого недомогания, гипокалиемии в биохимии крови нет; калий 4,1 ммоль/л — отсекает первичный гиперальдостеронизм (синдром Конна)",
      "общевоспалительных проявлений (длительной лихорадки, артралгий, ночных потов), снижения пульса на верхних конечностях, шумов над сонными и подключичными артериями, асимметрии АД на руках нет; СОЭ и СРБ в пределах нормы — снижает вероятность неспецифического аортоартериита (болезни Такаясу)",
      "отсутствует зависимость подъёмов АД от эмоционального напряжения с типичной картиной криза при гипертонической болезни; раннее начало (с 20 лет), резистентность к трёхкомпонентной терапии и асимметрия размеров и функции почек делают эссенциальную гипертензию менее вероятной",
      "хронических заболеваний почек (гломерулонефрита, пиелонефрита) в анамнезе нет; протеинурия минимальная, мочевой осадок без активного воспалительного компонента",
      "сахарного диабета, ожирения, метаболического синдрома нет",
      "беременностей и приёма гормональных контрацептивов не было"
    ]
  },
  "diagnosisOptions": [
    "Реноваскулярная артериальная гипертензия",
    "Гипертоническая болезнь III стадии",
    "Феохромоцитома",
    "Первичный гиперальдостеронизм (синдром Конна)",
    "Неспецифический аортоартериит (болезнь Такаясу)"
  ],
  "correctDiagnosis": "Реноваскулярная артериальная гипертензия"
}
