{
  "id": "cardiology-atrial-myxoma-001",
  "version": 1,
  "category": "Cardiology",
  "title": "Острая боль в пояснице на фоне инфарктов почки у молодой женщины",
  "difficulty": "hard",
  "tags": [
    "острая боль в пояснице",
    "системная эмболия",
    "инфаркт почки",
    "позиционно-изменчивый шум в сердце",
    "молодая женщина"
  ],
  "patientName": "Ольга Сергеевна Никитина",
  "patientAge": 37,
  "patientSex": "женский",
  "patientBrief": "Острая боль в правом боку и пояснице с тошнотой и рвотой, госпитализирована с подозрением на почечную колику; по МСКТ — инфаркты правой почки.",
  "passport": {
    "heightCm": 168,
    "weightKg": 60,
    "allergies": "не выявлено",
    "chronicConditions": "ранее считала себя здоровой",
    "smoking": "не курит"
  },
  "vitals": {
    "heartRate": 80,
    "bloodPressure": "120/80",
    "respiratoryRate": 16,
    "spo2": 98,
    "temperatureC": 36.8
  },
  "openingComplaint": "Доктор, я думала, у меня камень в почке: вчера утром резко скрутило в правом боку, потом тошнило и даже вырвало. Сейчас полегче, но всё равно ноет, и часто бегаю в туалет.",
  "authorNote": "37-летняя женщина, ранее считавшая себя здоровой; госпитализирована с подозрением на почечную колику, при обследовании выявлены инфаркты правой почки и образование в полости левого предсердия. Контактна, тревожна из-за неожиданности диагноза, говорит обстоятельно. О том, что в последние несколько месяцев иногда замечала эпизоды кратковременного головокружения и одышку при подъёме по лестнице, которые расценивала как «усталость» — рассказывает только при прямом вопросе о хронических симптомах со стороны сердца, эпизодах слабости, обмороках или одышке при нагрузке. О непостоянных, не связанных с инфекциями, эпизодах субфебрилитета и неспецифических болях/«ломоте» в крупных суставах за последние месяцы — раскрывает только при прямом вопросе о повышении температуры, болях в суставах или общем самочувствии за последний год. О потере массы тела на 2–3 кг за последние 2–3 месяца — при прямом вопросе о массе тела. О том, что ранее эпизодов нарушения ритма сердца, обмороков, инфарктов в семье не было — раскрывает при прямом вопросе о семейном анамнезе. Гормональных контрацептивов не принимает; беременностей не было; курение, употребление наркотиков отрицает (раскрывает при прямом вопросе). Сама о шуме в сердце не знает — это находка врача при аускультации. Лабораторные и инструментальные данные знает в общих чертах («сказали, в правой почке участки без кровоснабжения, и в сердце — какое-то образование»); конкретные цифры и описание ЭхоКГ раскрывайте только при прямом запросе врача о результатах. Самостоятельно слов «миксома», «эмболия», «эндокардит», «опухоль сердца» не использует.",
  "facts": {
    "symptoms": [
      "острая боль в поясничной области справа с иррадиацией в правую паховую область, появившаяся накануне утром",
      "тошнота и однократная рвота на высоте болевого приступа",
      "учащённые позывы к мочеиспусканию",
      "при прямом вопросе — эпизоды кратковременного головокружения и одышка при подъёме по лестнице за последние несколько месяцев",
      "при прямом вопросе — эпизодический неинфекционный субфебрилитет и неспецифические артралгии за последние месяцы",
      "при прямом вопросе — потеря массы тела на 2–3 кг за последние 2–3 месяца",
      "при осмотре: кожные покровы обычной окраски и влажности, периферических отёков нет, температура 36,8 °C",
      "при осмотре: ЧСС 80 в минуту, АД 120/80 мм рт. ст. — симметрично на правой и левой руках",
      "при аускультации сердца: аускультативная картина митрального стеноза (диастолический шум на верхушке с пресистолическим усилением, акцент I тона), которая отчётливо громче в вертикальном положении пациентки и заметно ослабевает в положении лёжа",
      "при осмотре: симптом поколачивания справа слабоположительный; пальпация живота безболезненна"
    ],
    "history": [
      "до настоящего эпизода считала себя здоровой, на учёте у врачей не состояла",
      "вчера утром остро возникла боль в правом боку и пояснице, госпитализирована СМП с подозрением на почечную колику",
      "беременностей не было, гормональные контрацептивы не принимает",
      "не курит, употребление наркотиков отрицает",
      "стоматологические инвазивные манипуляции и операции в последние 6 месяцев не проводились",
      "МСКТ органов брюшной полости и забрюшинного пространства с в/в контрастированием: инфаркты правой почки; правосторонний нефроптоз (сопутствующая находка, не объясняющая основного состояния)",
      "лабораторные данные: гемоглобин 124 г/л, лейкоциты 8,3 × 10⁹/л, тромбоциты 154 × 10⁹/л; калий 4,0 ммоль/л; мочевина 3,8 ммоль/л; креатинин 113 мкмоль/л",
      "СРБ в динамике: 3 → 32 → 60 → 21 мг/л (волнообразное повышение)",
      "ЛДГ в динамике: 1440 → 933 ЕД/л (закономерное снижение после острого тромбоза); D-димер в динамике: 401 → 232 нг/мл",
      "антитела к кардиолипину, антитела к β-2-гликопротеину I, антитела к фосфатидилсерину — отрицательные",
      "ЭКГ: синусовый ритм, ЧСС 75 в минуту, нормальное положение электрической оси сердца, неполная блокада правой ножки пучка Гиса; признаков фибрилляции предсердий нет",
      "ЭхоКГ: дилатация левого предсердия; в полости ЛП визуализируется округлой формы образование с относительно ровным контуром, занимающее значительную часть полости предсердия, размером 5,0 × 5,6 см, смешанной (преимущественно средней) эхогенности, наиболее вероятное место крепления — межпредсердная перегородка; образование вызывает лёгкую обструкцию приносящего тракта левого желудочка; имеется митральная регургитация, струя регургитации обтекает образование, достигая основания ЛП",
      "посевы крови (трёхкратные, из разных периферических вен) — роста микрофлоры не получено"
    ],
    "negatives": [
      "лихорадки выше 38 °C, потрясающих ознобов, профузных потов нет; на ладонях и подошвах геморрагических пятен (Джейнуэя), узелков Ослера, пятен Рота на глазном дне нет; посевы крови отрицательные — отсекает инфекционный эндокардит",
      "по ЭКГ — устойчивый синусовый ритм без волн f и без пароксизмов фибрилляции предсердий; данных за длительно существующую ФП по анамнезу и при наблюдении нет — снижает вероятность тромба левого предсердия на фоне фибрилляции предсердий",
      "антикардиолипиновые антитела, антитела к β-2-гликопротеину I и к фосфатидилсерину отрицательные; рецидивирующих венозных и артериальных тромбозов и невынашивания беременностей в анамнезе нет — отсекает антифосфолипидный синдром",
      "перенесённой острой ревматической лихорадки и эпизодов мигрирующего полиартрита в детстве и подростковом возрасте не помнит; деформаций митрального клапана и кальциноза створок при ЭхоКГ не выявлено — снижает вероятность ревматического митрального стеноза",
      "неврологической симптоматики (слабости в конечностях, нарушений речи, асимметрии лица), указывающих на эмболию в сосуды головного мозга, в момент осмотра нет",
      "болей в грудной клетке давящего/жгучего характера, типичных для острого коронарного синдрома, нет",
      "стоматологических инвазивных манипуляций и других потенциальных входных ворот инфекции в последние 6 месяцев не было"
    ]
  },
  "diagnosisOptions": [
    "Миксома левого предсердия",
    "Инфекционный эндокардит митрального клапана",
    "Антифосфолипидный синдром с системной эмболией",
    "Тромб левого предсердия на фоне неустановленной фибрилляции предсердий",
    "Ревматический митральный стеноз с системной эмболией"
  ],
  "correctDiagnosis": "Миксома левого предсердия"
}