{
  "id": "infection-pneumococcal-meningitis-001",
  "version": 1,
  "category": "Infections",
  "title": "Сильная головная боль и лихорадка у молодой женщины",
  "difficulty": "hard",
  "tags": [
    "головная боль",
    "лихорадка",
    "ригидность затылочных мышц",
    "светобоязнь",
    "менингеальные симптомы"
  ],
  "patientName": "Анастасия Андреевна Кузнецова",
  "patientAge": 28,
  "patientSex": "женский",
  "patientBrief": "Сильная головная боль и лихорадка около суток с болью в шее, светобоязнью и рвотой.",
  "passport": {
    "heightCm": 168,
    "weightKg": 58,
    "allergies": "не выявлено",
    "chronicConditions": "мигрень (редкие приступы)",
    "smoking": "не курит"
  },
  "vitals": {
    "heartRate": 120,
    "bloodPressure": "95/55",
    "respiratoryRate": 22,
    "spo2": 96,
    "temperatureC": 39.5
  },
  "openingComplaint": "Доктор, у меня со вчерашнего дня голова просто раскалывается, шею не повернуть. От света глаза режет, уже несколько раз вырвало. Подруга меня привезла — мне очень плохо.",
  "authorNote": "28-летняя аспирантка, проживает в общежитии. Привезена в приёмное отделение подругой. Чувствует себя крайне плохо: сильная головная боль, светобоязнь, тошнота. Говорит короткими фразами, морщится от света, прикрывает глаза рукой, периодически закрывает их. Заторможена, но в сознании, отвечает на вопросы. О недавней простуде (першение в горле, насморк, заложенность около недели назад, особенно справа) рассказывайте только при прямом вопросе о перенесённых ОРВИ/инфекциях ЛОР-органов. О поездке в Испанию (вернулась 13 дней назад) — только при прямом вопросе о путешествиях. О мигрени в анамнезе — только при прямом вопросе о хронических головных болях; обязательно подчеркните, что эта боль «совсем не такая, как при мигрени» — она другого характера, без обычной ауры. Данные осмотра, лабораторных и инструментальных исследований (КТ, люмбальная пункция, посев крови) пациентка сама не знает; раскрывайте их только при прямом запросе врача о результатах анализов или о карте, в формате «по карте, доктор…». Самостоятельно диагнозов не предлагать; слов «менингит», «пневмококк» не использовать.",
  "facts": {
    "symptoms": [
      "интенсивная головная боль, нарастающая в течение суток",
      "боль и тугоподвижность в шее, трудно повернуть голову",
      "лихорадка с ознобом",
      "тошнота и многократная рвота",
      "светобоязнь",
      "тяжёлое общее самочувствие, заторможенность, трудно сосредоточиться",
      "субъективное ощущение «такого никогда не было»"
    ],
    "history": [
      "начало головной боли постепенное, в течение последних суток интенсивность нарастала",
      "около недели назад перенесла лёгкую ОРВИ: першение в горле, насморк, заложенность носа (особенно справа)",
      "13 дней назад вернулась из туристической поездки по Испании",
      "в анамнезе редкие приступы мигрени; настоящий эпизод по характеру и тяжести существенно отличается от привычных приступов",
      "антибиотики и противовоспалительные препараты в последний месяц не принимала",
      "плановая вакцинация по календарю в детстве; о специфической вакцинации против пневмококка и менингококка сведений не имеет",
      "учится в аспирантуре, проживает в общежитии с соседкой",
      "при осмотре: температура 39,5 °C, ЧСС 120 в минуту, АД 95/55 мм рт. ст.; сознание сохранено, заторможена; выраженная ригидность затылочных мышц, симптомы Кернига и Брудзинского положительны; очаговой неврологической симптоматики нет; кожные покровы чистые; глазное дно без застоя дисков; пальпация области правого сосцевидного отростка болезненна",
      "общий анализ крови: лейкоциты 18,0 × 10⁹/л; СРБ 150 мг/л; натрий 133 ммоль/л; мочевина 12,2 ммоль/л; креатинин 111 мкмоль/л; альбумин 33 г/л",
      "рентгенография органов грудной клетки: без патологии",
      "КТ головного мозга: объёмных образований и признаков повышения внутричерепного давления нет; полное затемнение правой сосцевидной ячейки; частичное затемнение лобной и решётчатой пазух",
      "люмбальная пункция: давление СМЖ 34 см вод. ст.; ликвор мутный; общий белок 3,21 г/л; глюкоза ликвора 1,1 ммоль/л при гликемии 6,9 ммоль/л; цитоз 3200/мкл, 95 % нейтрофилов; окраска по Граму — микроорганизмов не выявлено; антигенные тесты на основные возбудители — отрицательны",
      "посев крови (через 12 часов): рост грамположительных диплококков в обоих флаконах"
    ],
    "negatives": [
      "сыпи на коже нет — ни петехиальной, ни геморрагической",
      "очаговой неврологической симптоматики нет (парезов, нарушений речи, координации)",
      "ауры, мерцающих огней, односторонних зрительных нарушений в этот раз не было",
      "черепно-мозговой травмы и нейрохирургических вмешательств в анамнезе не было",
      "спленэктомии не было",
      "известного иммунодефицита, ВИЧ-инфекции, гематологических заболеваний нет",
      "иммуносупрессивные препараты, ГКС, химиотерапию не получает",
      "антибактериальную терапию в последний месяц не получала",
      "злоупотребления алкоголем нет",
      "за пределами Европы в течение последнего года не была",
      "выделений из уха, снижения слуха не отмечает",
      "одышки, кашля, мокроты нет",
      "учащённого болезненного мочеиспускания, болей в пояснице нет",
      "среди близких контактов больных с лихорадкой, головной болью, сыпью нет"
    ]
  },
  "diagnosisOptions": [
    "Бактериальный менингит, вызванный Streptococcus pneumoniae",
    "Бактериальный менингит, вызванный Neisseria meningitidis",
    "Вирусный (асептический) менингит",
    "Субарахноидальное кровоизлияние",
    "Тяжёлый приступ мигрени"
  ],
  "correctDiagnosis": "Бактериальный менингит, вызванный Streptococcus pneumoniae"
}